{
  "schema_version": "0.1.0",
  "manifest_id": "hcx_manifest_0000000000000000000000000000",
  "created_at": "2026-08-31T00:00:00.000Z",
  "provider_id": "hcx",
  "model_id": "test-fixture-model",
  "model_config_id": "model_hcx-test-fixture-v1",
  "model_config_sha256": "0000000000000000000000000000000000000000000000000000000000000000",
  "endpoint_sha256": "1111111111111111111111111111111111111111111111111111111111111111",
  "endpoint_hostname": "127.0.0.1",
  "endpoint_is_loopback": true,
  "prompt_template_id": "structured-first-answer-prompt-v1",
  "prompt_template_sha256": "2222222222222222222222222222222222222222222222222222222222222222",
  "request_schema_version": "hcx-chat-completions-v3",
  "response_schema_version": "hcx-chat-completions-v3",
  "timeout_ms": 20000,
  "max_output_tokens": 512,
  "temperature": 0.3,
  "top_p": 0.8,
  "seed_supported": false,
  "code_revision": "unknown",
  "actual_external_call_authorized": false,
  "actual_external_generation_call_performed": false,
  "mock_generation_call_performed": true,
  "model_call_attempt_count": 1,
  "model_call_success_count": 1,
  "model_call_failure_count": 0,
  "model_failure_code": null,
  "model_fallback_used": false,
  "scoring_eligible": true
}
